<?xml version="1.0" encoding="utf-8" ?>
<!DOCTYPE configuration SYSTEM "config.dtd">
<configuration>
    <chatMessageFormat>$dir$ [$date$ $time$] [$nick$]: $message$</chatMessageFormat>
    <connection>
        <networkTypes>SOCKET</networkTypes>
        <server>true</server>
        <ip>192.168.2.104</ip>
        <serverPort>9292</serverPort>
    </connection>
    <user>
        <nick>Server User</nick>
        <uid>7a88108c-9596-4676-b4f1-bb941418bd9a</uid>
    </user>
</configuration>